Nom de l'association;Secteur d'activité;Ville;Adresse postale;Code postal;Adresse email;Téléphone;Statut de publication;Statut légal;Date de déclaration;Date de modification;Administrateur;N°RNA;N°SIRET;IdAssociation
Association Nationale pour les Ânes Retraités et Maltraités;Animaux ;La Robine-sur-Galabre;Le Château-Lambert;04000;;;Publiée;Déclarée;;06/06/2015 (Jean-Christophe LEONARD);Non;;;6070a23e-2995-40e5-9d91-a2a1926fbb73
Association nautique de montpezat;"Voile; Sports; Nautiques, piscines";Sainte-Croix-du-Verdon;Route du Bord du Lac;04500;;;Publiée;Déclarée;22/10/2014;09/06/2015 (System);Non;W043002174;;e485f97f-5dc7-4dcd-954d-cf9a0a137e53
Association notre dame de cana;"Religion, Culte, Philosophie; Social Entraide";Digne-les-Bains;Les tilleuls b. les arches, 13, ru paul-rouin;04000;;;Publiée;Déclarée;20/03/2005;10/06/2015 (System);Non;;;9eeb18d6-753c-4d20-9715-fa79a35f66cd
Association opus en couleurs;"Recherche; Art et Culture; Education, Formation, Recherche";Digne-les-Bains;;04000;opusencouleurs@laposte.net;;Publiée;Déclarée;20/05/2006;10/06/2015 (System);Non;;;322ef56c-f06d-4ded-a734-4e8b37f48d34
Association orcesi;Art et Culture;Digne-les-Bains;17, rue antoine-heroët;04000;;;Publiée;Déclarée;;14/04/2016 (System);Non;;;12577a5f-23f7-4655-a3ea-5b6989d8b970
Association o.r.l. du bassin dignois;"Recherche; Santé et Protection civile; Centre d'enseignement et de formation; Education, Formation, Recherche";Digne-les-Bains;Centre hospitalier;04000;;;Publiée;Déclarée;19/02/1997;16/06/2015 (System);Non;;;94f546e2-18a5-4827-8de6-595e68f474ae
Association paroissiale saint-jean de barreme;"Social Entraide; Interventions sociales; Art et Culture";Barrême;Chemin saint-jean;04330;;;Publiée;Déclarée;20/05/2006;10/06/2015 (System);Non;;;04f49b80-56f5-447c-8335-e48b59d8b2bd
Association partage culturel tibetain;Art et Culture;Digne-les-Bains;13 Avenue Maréchal Leclerc;04000;;;Publiée;Déclarée;20/10/2006;11/06/2015 (System);Non;;;ec329ecc-2a96-4fbb-b5d6-9d6e045b9e00
Association passerelle;Autres catégories;Aiglun;34, hameau du thoron;04510;;;Publiée;Dissoute;;16/06/2015 (System);Non;;;131a549c-adbe-4ae2-801a-2548e1d911a2
Association patrimoine et animation;"Social Entraide; Environnement, Développement durable; Actions socio-culturelles, centres de loisirs ; Tourisme";Mézel;Mairie;04270;;;Publiée;Déclarée;19/09/1998;14/04/2016 (System);Non;;;f14e2c18-56e4-4012-b973-c02344034e85
Association patrimoine, nature et environnement d'archail (A.P.N.E.A.);"Comités de défense, comités de sauvegarde; Environnement, Développement durable";Marcoux;4420 Le Village;04420;;;Publiée;Déclarée;27/08/2008;12/06/2015 (System);Non;;;f5c6d1bd-0732-4ec1-915b-617d4b699fb8
Association petite therese;"Social Entraide; Environnement, Développement durable; Interventions sociales";Digne-les-Bains;170, h.l.m. le pigeonnier;04000;;;Publiée;Déclarée;19/08/1999;07/06/2015 (System);Non;;;f76e1133-762d-4c6f-8e1e-bad5173b9ad3
Association plateforme technologique bioval +;"Recherche; Autres associations de recherche; Environnement, Développement durable; Education, Formation, Recherche";Digne-les-Bains;Iut de l'université de provence, 19, boulevard saint-jean chrysostome;04000;;;Publiée;Dissoute;20/04/2009;18/04/2016 (System);Non;W043000384;;cb9510e6-0f94-4ba5-8c81-4aeb8b5d5d03
Association pour l'amelioration des produits agricoles transformes;"Recherche; Centre d'enseignement et de formation; Economie; Education, Formation, Recherche";Digne-les-Bains;Chambre d'agriculture des alpes-de-haute-provence, 66, boulevard gassendi;04000;;;Publiée;Déclarée;19/10/1998;05/06/2015 (System);Non;;;e6dfe1a7-37bf-407b-b625-f0cd77e11e03
Association pour l'assurance des eleves des etablissements d'enseignement public des alpes-de-haute-provence;"Economie; Interventions sociales";Digne-les-Bains;M.a.e. solidarité, 32, boulevard victor-hugo;04000;;;Publiée;Déclarée;;14/04/2016 (System);Non;;;ccadeedb-4235-41b2-8f82-51bd8033b4f9
Association pour l'elimination des dechets hospitaliers du departement des alpes-de-haute-provence (APEDH 04);Economie;Digne-les-Bains;Lieu-dit Saint-Christophe;04000;;;Publiée;Dissoute;;08/06/2015 (System);Non;;;92b1988a-323b-416c-8001-ead595469624
Association pour l'etude des poetiques administratives;"Loisirs; Clubs de réflexion; Clubs, Cercles de réflexion";Digne-les-Bains;Chemin du bourg;04000;;;Publiée;Déclarée;20/10/2011;17/04/2016 (System);Non;W043001870;;74aeb74f-0216-4054-96f7-4fa02e2c3637
Association pour l'etude et la sauvegarde du patrimoine religieux des ahp;Préservation du patrimoine;Digne-les-Bains;13, avenue paul martin;04000;;0492313290;Publiée;Déclarée;01/01/1900;26/03/2015 (Alexandre Siahou);Non;;;6b684fe4-93b3-4fda-ac08-d5fd9cd049d1
Association pour l'integration, le soutien, l'accompagnement au travail et a l'insertion sociale (I.S.A.T.I.S);Insertion, Aide à l'emploi, vie locale;Digne-les-Bains;4, chemin du belvédère;04000;digne@isatis.org;0492326232;Publiée;Déclarée;01/01/1900;27/03/2015 (sandrine Fabry);Non;;;89bf3f87-5961-4326-9581-2c818c1fec87
Association pour la creation du parc naturel regional du verdon;Environnement, Développement durable;Moustiers-Sainte-Marie;Mairie, hôtel de ville;04360;;;Publiée;Dissoute;;04/06/2015 (System);Non;;;bde88f30-c7bb-4513-acb9-c430712e784a
Association pour la Formation des Actions Commerciales Hyperendiablees;Centre d'enseignement et de formation;Champtercier;zone artisanale Champtercier;04660;;;Publiée;Déclarée;;15/04/2015 (Alexandre Siahou);Non;;;abf8df03-62ea-41e1-9fd3-c78e2e3fe19d
Association pour la formation des actions commerciales hyperendiablees (A.P.A.C.H.E.);Education, Formation, Recherche;Champtercier;Zone artisanale champtercier;04660;;;Publiée;Déclarée;19/09/1997;16/06/2015 (System);Non;;;ff34360c-5d20-4f30-92e0-d5690b558944
Association pour la gestion de la reserve geographique de haute-provence;Recherche;Digne-les-Bains;Quartier saint-benoît;04000;;;Publiée;Déclarée;;05/06/2015 (System);Non;;;37efb74c-c981-458d-af17-c391ed0294f4
Association pour la gestion de la reserve geologique de haute-provence;"Recherche; Education, Formation, Recherche";Digne-les-Bains;Centre de géologie, quartier saint-benoît;04000;;;Publiée;Déclarée;;22/06/2015 (System);Non;;;fe01ccb1-b7fa-4936-8f2f-e79d06f04cdf
Association pour la memoire de la resistance, de l'internement et de la deportation des basses-alpes;"Militaire-Armée; Social Entraide; Anciens combattants";Digne-les-Bains;10 Avenue Joseph Reinach;04000;;;Publiée;Déclarée;;10/06/2015 (System);Non;;;32dde772-addc-4476-ae4b-2f8043e03f37
Association pour la participation et l'action regionale (APARE) DELEGATION ALPES-DE-HAUTE-PROVENCE;"Environnement, Développement durable; Art et Culture";Digne-les-Bains;5, avenue paul-martin;04000;apare@apare-gec.org;;Publiée;Déclarée;;16/04/2016 (System);Non;;;bf18d315-b08a-4bfb-b073-f3d434edf957
Association pour la production des activites musicales en milieu scolaire (APAMMS 04);Art et Culture;Digne-les-Bains;Inspection académique, avenue du plantois;04004;;;Publiée;Déclarée;19/10/1997;16/06/2015 (System);Non;;;00bb8fdb-23cd-4b9f-afca-ab64284cbc89
Association pour la promotion de la formation aux urgences de manosque (AP FUN);"Santé et Protection civile; Education, Formation, Recherche";Digne-les-Bains;5, rue pierre-builly;04000;;;Publiée;Déclarée;20/11/2002;14/04/2016 (System);Non;;;684c4c21-62fa-48cd-9ae6-8597d7351a25
Association pour la promotion des actions commerciales hyper endiable;Economie;Champtercier;Z.a. n  12;04660;;;Publiée;Dissoute;;22/06/2015 (System);Non;;;c4304784-8677-49e1-b2ec-3cf94755d36b
Association pour la promotion des actions sociales et educatives;"Service et établissements médico-sociaux; Santé et Protection civile; Social Entraide; Loisirs pour personnes en situation de handicap; Actions socio-culturelles, centres de loisirs ; Interventions sociales; Aide sociale aux personnes en situation de handicap";Digne-les-Bains;13, avenue paul-martin;04000;;;Publiée;Déclarée;;23/06/2015 (System);Non;W043000536;;e0078d5d-d12c-430e-89a5-3c74cc508757
Association pour la promotion des activites en milieu scolaire (A.P.A.M.M.S. 04);"Musique; Chant, Chorale; Activités artistiques; Art et Culture";Digne-les-Bains;Avenue du plantas;04000;;;Publiée;Déclarée;;12/06/2015 (System);Non;;;caf2e516-59ab-4abc-a007-4afbeeb10640
Association pour la promotion des cucurbitacees et des legumes anciens;"Recherche; Loisirs; Actions socio-culturelles, centres de loisirs ; Education, Formation, Recherche";Mézel;Chez m. ledoux (yannick), bar de l'avenue;04270;;;Publiée;Déclarée;20/11/2001;14/04/2016 (System);Non;;;ff70a5aa-4898-4d46-9d26-a7480b0f1e1f
Association pour la promotion des plantes a parfum aromatiques et medicinales;"Recherche; Social Entraide; Amicale, groupement d'entraide, solidarité ; Rencontre";Digne-les-Bains;Hôtel de ville;04000;appam@wanadoo.fr;0492320383;Publiée;Déclarée;01/01/1900;03/06/2016 (LOU  VANIE);Non;;;eadb9186-7f85-4dc8-be32-5f2454a389f0
Association pour la promotion du patrimoine de pays des alpes-de-haute-provence (A.P.P.P. 04);Art et Culture;Digne-les-Bains;Chambre d'agriculture des alpes-de-haute-provence, 66, boulevard gassendi;04000;;;Publiée;Déclarée;22/06/2005;10/06/2015 (System);Non;;;8bbcd76c-cfa8-4916-91ba-77d24a2f121b
Association pour la promotion du patrimoine et de l'environnement de beynes;"Comités de défense du patrimoine; Préservation du patrimoine; Art et Culture";Beynes;Les guberts;04270;;;Publiée;Déclarée;20/12/2012;18/04/2016 (System);Non;W043001992;;1b3ed634-761d-4489-aec1-1b50c423bc80
Association pour la promotion, le developpement et l'animation de l'agritourisme dans les a.h.p. bienvenue a la ferme alpes-provence;Tourisme;Digne-les-Bains;66, boulevard gassendi, bp 117;04004;;;Publiée;Déclarée;;12/06/2015 (System);Non;;;cc4cb51f-c431-4a21-b35a-db5ed13b2fcc
Association pour la promotion touristique de digne-les-bains et du pays dignois;"Syndicat d'initiative, office de tourisme, salons du tourisme; Economie; Tourisme";Digne-les-Bains;Centre desmichels, boulevard martin-bret;04000;;;Publiée;Déclarée;;16/06/2015 (System);Non;;;81aa7d2d-1fe6-4cfe-a549-98ece87fd7ce
"Association pour la protection de l'environnement de moustiers ste marie et des quartiers treguier st michel et autres ""la colline veille""";"Comités de défense du patrimoine; Préservation du patrimoine; Art et Culture";Moustiers-Sainte-Marie;Chemin de tréguier haut;04360;;;Publiée;Déclarée;24/10/2013;09/06/2015 (System);Non;W043002076;;fa345eb6-d650-4c24-9b31-bb356c4ab46b
Association pour la protection de l'environnement des hautes vallees de l'asse;Environnement, Développement durable;Barrême;5, lotissement les condamines;04330;;;Publiée;Déclarée;19/02/1999;07/06/2015 (System);Non;;;3aabc4dd-f9de-43b5-9e94-4cc35ea88770
Association pour la readaptation sociale;Interventions sociales;Digne-les-Bains;Tribunal de grande instance;04014;;;Publiée;Déclarée;;04/06/2015 (System);Non;;;e0e80409-a045-4f47-a43f-82b1ad48220a
Association pour la readaptation sociale;"Hôpitaux et autres centres médicaux; Santé et Protection civile; Interventions sociales; Centres de réadaptation";Aiglun;5, impasse le vallon;04510;;;Publiée;Déclarée;;08/06/2015 (System);Non;;;a46ecc00-9f86-42fe-b7cc-ae8c7d69d36f
Association pour la readaptation sociale (A.R.S.);Interventions sociales;Digne-les-Bains;11, rue des epinettes;04000;;;Publiée;Dissoute;;14/04/2016 (System);Non;;;538f6158-e6e6-48a7-bad3-d120679db387
Association pour la recherche et la documentation archeologiques en haute-provence;Art et Culture;Digne-les-Bains;8, avenue du camping;04000;;;Publiée;Déclarée;;15/04/2016 (System);Non;;;b40b7ed4-be08-45c9-b277-0961f73d4e25
Association pour la recherche et la documentation archeologique en haute provence (ARDA - H.P.);Art et Culture;Digne-les-Bains;8 rue du souvenir Français;04000;arda04@laposte.net;0601946836;Publiée;Déclarée;;10/10/2016 (Natalie LEROY);Oui;W043001174;;a158c278-2cb1-4574-9231-78d010e45e96
Association pour la sauvegarde de la chapelle de chaudon;"Défense des droits fondamentaux, activités civiques; Environnement, Développement durable";Barrême;Rue Principale;04330;;;Publiée;Dissoute;;15/04/2016 (System);Non;;;0de230b7-3c9a-44fd-a391-c12c0ae1833e
Association pour la sauvegarde de la chapelle familiale de beaudinard;Environnement, Développement durable;Aiglun;545, voie impériale la roche-frison;04510;;;Publiée;Déclarée;20/01/2000;16/06/2015 (System);Non;;;4b0368ec-6567-493b-8613-28af08c4c80c
Association pour la sauvegarde et la rehabilitation de la barre des dourbes;"Economie; Interventions sociales; Art et Culture";Digne-les-Bains;3, chemin des granges, le villard-des-dourbes;04000;;;Publiée;Déclarée;20/02/2003;15/04/2016 (System);Non;;;7070cdc6-d03a-47ae-8485-6399c62ebc5e
Association pour le desenclavement de l'est du departement des alpes-de-hautes-provence par la a 585;Environnement, Développement durable;Digne-les-Bains;Centre desmichel, boulevard martin-bret;04000;;;Publiée;Déclarée;19/10/1999;08/06/2015 (System);Non;;;f72a25b0-762b-4b54-8357-4d828083ba02
Association pour le developpement de l'agriculture 04;Economie;Digne-les-Bains;Immeuble chambre d'agriculture, 66, boulevard cassendi, b.p. 117;04000;;;Publiée;Dissoute;;08/06/2015 (System);Non;;;74817eeb-7f0f-45f0-8c4b-447b3c231a62
Association pour le developpement des recherches sur l'environnement technologique;"Recherche; Loisirs scientifiques et techniques; Loisirs; Environnement, Développement durable; Education, Formation, Recherche";Marcoux;Le pigeon blanc, près-du-pous;04420;;;Publiée;Déclarée;19/10/1997;16/06/2015 (System);Non;;;2aece86f-75f6-49d4-8d17-0127109401d3
Association pour le developpement des relations entre musiciens amateurs et professionnels;"Musique; Activités artistiques; Art et Culture";Digne-les-Bains;13, rue paul-rouit;04000;;;Publiée;Déclarée;19/04/1997;16/06/2015 (System);Non;;;be446269-2e32-4753-9ab7-a698dc3d2481
Association pour le don de sang benevoles de digne les bains;Santé et Protection civile;Digne-les-Bains;Centre desmichels;04000;;0492324107;Publiée;Déclarée;01/01/1900;27/03/2015 (sandrine Fabry);Non;;;f3ee896a-660e-415e-ac8a-4ac66a48ea80
Association pour le droit de mourir dans la dignite;Social Entraide;Digne-les-Bains;18, avenue des charrois;04000;admd04@admd.net;0486899211;Publiée;Déclarée;01/01/1900;11/05/2015 (Alexandre Siahou);Oui;;;04f1c450-079c-404f-956c-13914dea1528
Association pour le traitement des ordures menageres (A.T.O.M.);"Recherche; Environnement, Développement durable; Education, Formation, Recherche";Moustiers-Sainte-Marie;La chêneraie;04360;;;Publiée;Déclarée;19/05/1997;16/06/2015 (System);Non;;;60ef15e4-5e26-4e9c-a7e6-6943c2500d3d
Association pour les residants de courbons;"Comités de défense du patrimoine; Préservation du patrimoine; Environnement, Développement durable; Art et Culture; Défense et amélioration du cadre de vie";Digne-les-Bains;Chemin de chastranelle;04000;;;Publiée;Déclarée;20/11/2008;12/06/2015 (System);Non;W043000113;;c5aa34be-1c50-4f2f-a5ad-fab2d2032211
Association pour un desenclavement routier du pays dignois;"Groupements d'entraide et de solidarité; Social Entraide; Amicale, groupement d'entraide, solidarité ";Digne-les-Bains;18,, chemin ste thérèse, la sèbe;04000;;;Publiée;Déclarée;20/02/2010;15/06/2015 (System);Non;W043000650;;8f3a3b8e-80da-41d2-bd01-b40b0f124d1b
Association profession sport de la region provence-alpes-cote d'azur;"Recherche; Sports";Digne-les-Bains;Immeuble la riviéra, 5, avenue de verdun;04004;;;Publiée;Déclarée;19/03/1998;04/06/2015 (System);Non;;;5fd8a69a-83eb-4ddb-a053-96773afd2a25
Association protestante evangelique action pour l'enfance, la jeunesse et la famille (A.E.J.F.);"Défense des droits fondamentaux, activités civiques; Sports; Art et Culture";Digne-les-Bains;62, avenue henri-jaubert;04000;;;Publiée;Déclarée;;15/04/2016 (System);Non;;;1d6067cb-7590-40c9-89c7-2d40274c5dad
Association reagir;Recherche;Digne-les-Bains;C.f.a. rené-villeneuve, 15, rue maldouat;04002;;;Publiée;Déclarée;19/12/1997;03/06/2015 (System);Non;;;af2ce5af-a55e-4985-aef3-026f374b9b43
Association regionale des directeurs d'iut de la region paca;Education, Formation, Recherche;Digne-les-Bains;Boulevard saint-jean-chrysostome;04000;;;Publiée;Déclarée;30/05/2008;12/06/2015 (System);Non;;;b60295ad-16cf-4c4f-ba44-52ca3b882afa
Association representative des droits de l'homme en france;"Défense des droits fondamentaux, activités civiques; Défense des libertés publiques et des droits de l'Homme; Justice";Digne-les-Bains;Rue de Gassendy;04000;;;Publiée;Déclarée;20/03/2009;13/06/2015 (System);Non;W043000341;;f2dc87ed-d85c-4790-b270-c62fce58290c
Association saint benoit labre;Logement;Digne-les-Bains;15, rue de la mère de dieu;04001;;0492315727;Publiée;Déclarée;01/01/1900;27/03/2015 (sandrine Fabry);Non;;;8a10a6ed-2f70-4599-afed-d9b86b8ef5f2
Association saint-jacques chastan;"Interventions sociales; Art et Culture";Digne-les-Bains;;04002;;;Publiée;Déclarée;19/09/1999;07/06/2015 (System);Non;;;ff612f4e-4b40-42c4-abfb-8b5efc8a88a0
Association saint-jean-de-haute-provence;"Recherche; Social Entraide; Art et Culture; Education, Formation, Recherche";Digne-les-Bains;10 Rue des Romarins;04000;;;Publiée;Déclarée;;16/06/2015 (System);Non;;;836cfd1d-d868-4da6-a517-7d45542c5db1
Association securite sociale sportive des organismes sociaux des alpes-de-haute-provence;"Social Entraide; Organisation de professions (hors caractère syndical); Amicale, groupement d'entraide, solidarité ";Digne-les-Bains;3 Rue Alphonse Richard;04000;;;Publiée;Déclarée;20/03/2012;17/04/2016 (System);Non;W043001923;;0694d33c-4d6c-4ac9-aee3-aab09ca7a4d1
Association sei san dojo;"Sports individuels; Karaté; Sports; Arts martiaux";Bras-d'Asse;Vallon d'enriou, la bégude;04270;;;Publiée;Déclarée;;16/06/2015 (System);Non;;;0cad4208-171a-4e2a-92ba-032536fedb06
Association sociale pour le culte des temoins de jehovah de digne-les-bains;"Religion, Culte, Philosophie; Social Entraide";Le Grand Saint-Martin;;04000;;;Publiée;Déclarée;;21/06/2015 (System);Non;;;2f6bd630-3491-4311-9fb7-d4407231019a
Association socio-educative, culturelle et sportive des maisons d'arret de digne-les-bains et de gap;Sports;Digne-les-Bains;Montée Saint-Charles;04000;;;Publiée;Déclarée;;13/06/2016 (System);Non;W043001077;;2e83f0bf-e08b-4c40-b76f-3c7dbd93efe3
Association speed action;"Religion, Culte, Philosophie; Social Entraide";Digne-les-Bains;C.f.a. rené-villeneuve, 15, rue maldonat;04000;;;Publiée;Dissoute;;16/06/2015 (System);Non;;;6ba241b2-6924-4d04-b684-fcebb5f7f4f3
Association sport medecine;"Recherche; Santé et Protection civile; Sports";Digne-les-Bains;61 Boulevard Gassendi;04000;;;Publiée;Déclarée;;22/06/2015 (System);Non;;;4b91cd1c-14af-49da-ad8e-fce84601debf
Association sport medecine;"Sports; Information et Communication";Digne-les-Bains;53, boulevard gassendi;04000;;;Publiée;Déclarée;;16/06/2015 (System);Non;;;a2e05266-548d-4e25-9fc9-aed182ac05e7
Association sportive d'estoublon;"Musique; Sports; Activités artistiques; Art et Culture";Estoublon;Mairie, rue louis-laurens;04270;;;Publiée;Déclarée;20/10/2000;22/06/2015 (System);Non;;;24599e6b-f779-4bf0-ac27-fbbc3fe62aba
Association sportive des ecuries de chambaresc;"Recherche; Sports; Actions socio-culturelles, centres de loisirs ";Barrême;Quartier saint-jean;04330;;;Publiée;Déclarée;;16/04/2016 (System);Non;;;f15346fd-146e-427e-94da-c93d133a279e
Association sportive dignoise (A.S.D.);Sports;Digne-les-Bains;10, avenue des thermes, h.l.m. le pigeonnier n  135, bâtiment 7;04000;;;Publiée;Déclarée;19/05/1999;07/06/2015 (System);Non;;;bec16cae-8ebe-4fb3-a6e7-ed1aa207184f
Association sportive du college de digne;"Sports; Actions socio-culturelles, centres de loisirs ";Digne-les-Bains;Collège maria-borrely, 5, place des cordeliers, b.p. 122;04000;;;Publiée;Déclarée;;16/04/2016 (System);Non;;;0102da8c-144d-4517-bb4c-9883f37daccb
Association sportive et culturelle de moustiers;"Sports individuels; Sports; Activités de plein air ; Associations multisports locales";Moustiers-Sainte-Marie;Rue du Seigneur de la Clue;04360;;;Publiée;Dissoute;20/08/2016;03/09/2016 (System);Non;W043002366;;d9edb0d0-0e48-4a14-a940-1d1ff5619b6d
Association sportive et recreative dignoise (A.S.E.R.D.I.), CLUB DE TWIRLING, GROUPE « LES GOLDEN STARS »;"Sports; Actions socio-culturelles, centres de loisirs ";Digne-les-Bains;Le they, appartement 85, 1, rue gassend;04000;;;Publiée;Déclarée;20/11/2001;14/04/2016 (System);Non;;;1b1cd72d-ec4b-4115-84c4-f20b929aec4b
Association sportive mezelienne (A.S.M.);Sports;Mézel;Ancienne salle polyvalente;04270;;;Publiée;Dissoute;20/09/2000;23/06/2015 (System);Non;;;a7a315fe-e3db-4f9f-9758-5aa2ded4d00f
Association sportive montagne et loisirs (ASMEL);"Recherche; Sports";Digne-les-Bains;1, rue maldonat;04000;;;Publiée;Déclarée;;15/04/2016 (System);Non;;;02e9f22d-76dd-4e75-b996-25ca8d8106e2
Association sportive organicoach;"Sports individuels; Marche sportive; Sports; Raid; Activités de plein air ";Digne-les-Bains;7,, impasse du puits;04000;;;Publiée;Déclarée;20/07/2012;17/04/2016 (System);Non;W043001950;;f27597f8-bbb0-47b1-8ba1-c99a3b938205
Association sportive pigeonnier (A.S.P.);"Sports; Actions socio-culturelles, centres de loisirs ";Digne-les-Bains;31, h.l.m barbejas, 28, avenue des thermes;04000;;;Publiée;Déclarée;;15/04/2016 (System);Non;;;40fbd02e-98c3-4643-b137-b1610bfeded2
Association sportive saint-ursule du sacre coeur.;Sports;Digne-les-Bains;2, avenue des thermes;04000;;;Publiée;Déclarée;;19/12/2014 (System);Non;;;ea56ee78-8029-4043-a8a9-80ec56e718d4
Association syndicale des medecins et pharmaciens hospitaliers de digne-les-bains;"Santé et Protection civile; Défense des droits fondamentaux, activités civiques; Justice; Education, Formation, Recherche";Digne-les-Bains;Centre hospitalier de digne, service de radiologie;04000;;;Publiée;Déclarée;20/04/2006;10/06/2015 (System);Non;;;6030b845-cb52-478c-a6a0-488f1dd4f08b
"Association syndicale du lotissement ""le cabanon""";Solidarité internationale;Digne-les-Bains;60 Route du Chaffaut;04000;;;Publiée;Déclarée;20/05/2016;03/07/2016 (System);Non;W043002349;;3657db7c-7ce6-4bff-b858-99e5d612b5dc
Association touristique sportive et culturelle des administrations financieres des alpes-de-haute-provence (A.T.S.C.A.F.);"Sports; Art et Culture";Digne-les-Bains;26, rue alphonse-richard;04000;;;Publiée;Déclarée;;14/04/2016 (System);Non;;;ed2d9ad8-0974-433d-892b-ceef1088927c
Association transversales;Entretien et développement corporel;Digne-les-Bains;1, hameau de saint pierre;04000;;0492322736;Publiée;Déclarée;01/01/1900;26/03/2015 (Alexandre Siahou);Non;;;edda5513-63f2-43ad-862a-3eb2766a6c99
Association usep itep de champtercier;"Social Entraide; Actions socio-culturelles, centres de loisirs ; Mouvements éducatifs de jeunesse et d'éducation populaire";Champtercier;Le village;04660;;;Publiée;Déclarée;27/03/2013;09/06/2015 (System);Non;W043002020;;bdd4d948-0e07-450c-ac9d-ecf22930649c
Association usep paul martin maternelle;"Sports; Associations multisports scolaires ou universitaires; Multisports";Digne-les-Bains;Avenue paul-martin;04000;;;Publiée;Déclarée;20/11/2007;12/06/2015 (System);Non;;;f72fb606-6496-42fa-9756-b03920306b6a
Association vtt collector.;"Sports individuels; Sports; Cyclisme (Vélo)";Digne-les-Bains;11, traverse des roses;04000;;;Publiée;Déclarée;03/12/2008;27/12/2014 (System);Non;W043000160;;cde5c802-9d31-462e-83f8-ded442bfeda0
Assosphere;"Insertion, Aide à l'emploi, vie locale; Social Entraide; Échanges locaux, réseaux d'échanges";Digne-les-Bains;9 Chemin de Mouiroues;04000;;;Publiée;Déclarée;22/07/2014;03/09/2015 (Jean-Christophe LEONARD);Non;W043002135;;7136a496-ec4e-4ef1-93c6-d7a2779cbceb
Assurance autonome departementale de solidarite de l'enseignement public des alpes-de-haute-provence;Interventions sociales;Digne-les-Bains;13, boulevard victor-hugo;04000;;;Publiée;Déclarée;;14/04/2016 (System);Non;;;b39e3bbb-84d6-4d25-a486-9be5b50e0dd5
Atelier 04 perspective;Promotion de l'art et des artistes;Digne-les-Bains;12,, rue du colonel payan;04000;;;Publiée;Déclarée;20/03/2016;19/04/2016 (System);Non;W043002325;;af41ffeb-a3da-4800-9c50-ef424f888ab5
Atelier choral de haute-provence;"Musique; Centre d'enseignement et de formation; Chant, Chorale; Activités artistiques; Art et Culture; Education, Formation, Recherche";Digne-les-Bains;Boulevard victor-hugo;04000;atelierchoral04@free.fr;;Publiée;Déclarée;;12/06/2015 (System);Non;;;2257c656-c40d-4380-8ce4-05cb271029c4
Atelier danse perspective 04;Danse;Digne-les-Bains;Les airelles - 3, allée des fontainiers;04000;;;Publiée;Déclarée;01/01/1900;24/04/2014 (System);Non;;;65f84037-1c20-4ab0-a1a4-98ef912b124c
Atelier de Realisation et de Techniques de Spectacles;Promotion de l'art et des artistes;Digne-les-Bains;66, boulevard Victor-Hugo;04000;;;Publiée;Non déclarée;;15/04/2015 (Alexandre Siahou);Non;;;73c16b20-5637-43d6-b2da-a528ae29e261
Atelier « le puits a coqs »;Art et Culture;Digne-les-Bains;8, boulevard gassendi;04000;nouveaulookdedigne-sarl@neuf.fr;;Publiée;Déclarée;20/06/2008;12/06/2015 (System);Non;;;c1d54deb-e25b-4df9-a3d1-c9b4fd3b6846
Atelier partage;"Social Entraide; Actions socio-culturelles, centres de loisirs ; Foyers ruraux";Digne-les-Bains;Rue Jean Gaspard Gassend;04000;;;Publiée;Déclarée;20/01/2015;08/06/2015 (System);Non;W043002203;;bd4119d0-65f5-47ab-a421-3d50c6f08327
Atelier pierre gassendi;Art et Culture;Digne-les-Bains;Ancienne gare de gaubert-le-chaffaut;04000;;;Publiée;Déclarée;19/04/1997;16/06/2015 (System);Non;;;9adf644b-24b2-486d-bde7-0b83c316a526
