Nom de l'association;Secteur d'activité;Ville;Adresse postale;Code postal;Adresse email;Téléphone;Statut de publication;Statut légal;Date de déclaration;Date de modification;Administrateur;N°RNA;N°SIRET;IdAssociation
J.b.p. spectacles organisation;Art et Culture;Digne-les-Bains;29, boulevard gassendi;04000;biblemontpotvin@hotmail.com;;Publiée;Déclarée;20/12/2001;14/04/2016 (System);Non;;;e9e2f4b4-0606-4263-ad3b-e9a2c28264c5
Jean'bis;"Centre d'enseignement et de formation; Établissement de formation professionnelle et continue; Education, Formation, Recherche";Digne-les-Bains;Boulevard soustre;04000;;;Publiée;Déclarée;20/08/2010;15/06/2015 (System);Non;W043000901;;77623865-9db1-485d-aa16-9bcc36f36d81
Jeune chambre economique de digne-les-bains;Economie;Digne-les-Bains;60 Boulevard Gassendi;04000;;;Publiée;Déclarée;;21/06/2015 (System);Non;;;c0e67e8b-3767-4454-aa54-b62d4d92e854
Jeunes Européens de Marseille;Information et Communication;Marseille;5 Quai de la Joliette;13002;jeuneseuropeensdemarseille@gmail.com;0950846552;Non publiée;Déclarée;28/05/2014;24/07/2015 (Alexandre Siahou);Non;;;90fedfa0-00de-4d71-a201-bb832ac36471
Jeunesse avenir digne;"Social Entraide; Humanitaire et Caritatif; Actions socio-culturelles, centres de loisirs ; Interventions sociales";Digne-les-Bains;12, rue de la juiverie, n  14 les chapeliers, hlm;04000;;;Publiée;Déclarée;19/03/1997;16/06/2015 (System);Non;;;c34ba22a-0199-437a-969a-15bff5243ced
Jeunesse - verite et vie;"Sports; Interventions sociales; Art et Culture";Digne-les-Bains;33, boulevard victor-hugo;04000;;;Publiée;Déclarée;20/10/2000;22/06/2015 (System);Non;;;f127ec49-d3fb-432f-9fbf-4d38daf6d048
Jeunesses musicales de france (JMF);Représentation, promotion et défense d'intérêts économiques;Digne-les-Bains;7, rue de l'avenir;04000;jmfdigne@yahoo.fr;0492310922;Publiée;Déclarée;01/01/1900;26/03/2015 (Alexandre Siahou);Non;;;18fd0c17-4d43-4f25-9017-6c859577cf8e
Joggy box;Art et Culture;Digne-les-Bains;30, rue beethoven, hameau de chantecler;04000;;;Publiée;Déclarée;;16/04/2016 (System);Non;;;b1aab71b-0560-4991-b1b8-34c805931d0b
Jouventura 60;"Travaux manuels; Loisirs";Saint-Jurs;Village;04410;;;Publiée;Déclarée;20/07/2012;17/04/2016 (System);Non;W043001948;;64800bd6-c1e7-4810-a0b0-abd71e6a99d2
Judo club dignois;Sports;Digne-les-Bains;Caserne desmichels;04000;;;Publiée;Déclarée;;07/06/2015 (System);Non;;;6c5060dc-d360-46e7-8100-b47e539a8488
JUDO et JU JITSU - JUDO CLUB DIGNOIS;"Judo; Arts martiaux; Jujitsu";Digne-les-Bains;Dojo Jean Rolland;04000;judoclubdignois@wanadoo.fr;0492311041;Publiée;Déclarée;;26/03/2015 (Alexandre Siahou);Non;;;00e55967-3d02-4775-af01-ac3a72745da9
Juris'alpes;"Sports; Art et Culture";Digne-les-Bains;Ordre des avocats, place des récollets;04000;;;Publiée;Déclarée;19/11/1997;16/06/2015 (System);Non;;;854b4036-df0e-4998-8374-59e1676fa1c1
Kapa2;"Recherche; Centre d'enseignement et de formation; Social Entraide; Interventions sociales; Art et Culture; Education, Formation, Recherche";Digne-les-Bains;44 Avenue Demontzey;04000;info@kapa2.com;;Publiée;Déclarée;20/07/2005;10/06/2015 (System);Non;;;fc6cdaa5-52b7-44d0-b5b9-7cdee985af9f
Karate club dignois;"Sports individuels; Karaté; Sports; Autres arts martiaux; Arts martiaux";Digne-les-Bains;9, avenue de verdun;04000;clubskarate@free.fr;0492624022;Publiée;Déclarée;;12/06/2015 (System);Non;;;7d3c00c9-3cbb-45f3-b20a-fa767ed3901a
Karate-club oraison;"Sports individuels; Karaté; Sports; Arts martiaux";Saint-Julien-d'Asse;La louvière;04270;;;Publiée;Déclarée;;22/06/2015 (System);Non;;;225ef790-f338-48f8-8ddd-682d1b598fa3
Kariel B. Edition;"Littérature; Activités artistiques; Art et Culture; Information et Communication; Presse, édition";Digne-les-Bains;4, chemin des rouquets;04000;;;Publiée;Déclarée;18/09/2009;28/10/2015 (Daniel Berthet);Oui;W043000542;51741926300010;73ee9ce6-498d-4290-b227-a2b9eaefba1e
Kermesse des missions notre-dame-du-bourg;Actions socio-culturelles, centres de loisirs ;Digne-les-Bains;Sainte enfance, 19, rue du prévôt;04000;;;Publiée;Déclarée;;14/04/2016 (System);Non;;;2461028e-0237-4295-a23f-37108d488bec
L'accueil;Autres catégories;Digne-les-Bains;Orphelinat saint-martin;04000;;;Publiée;Déclarée;;08/06/2015 (System);Non;;;41801cc1-6ebc-4329-b771-8f429c3cd291
L'aglandou d'estoublon;"Comités des fêtes; Social Entraide; Actions socio-culturelles, centres de loisirs ";Estoublon;;04270;;;Publiée;Déclarée;28/02/2008;12/06/2015 (System);Non;;;6b077914-3254-4446-b879-bdbaa5b0b4cb
L'amicale du quatre temps;"Loisirs; Actions socio-culturelles, centres de loisirs ";Digne-les-Bains;Lycée professionnel beau-de-rochas, 10, avenue maréchal-leclerc;04000;;;Publiée;Déclarée;19/01/1999;05/06/2015 (System);Non;;;4ea67e6e-9a47-4004-8615-88571d54ef52
L'amitié Musicale;Chant, Chorale;Digne-les-Bains;8, cours du Tribunal;04000;;0492311865;Publiée;Déclarée;01/01/1900;25/03/2015 (Elias Administrateur Galoo);Non;;;25c2a3b2-d095-4276-aaa1-fc75caba3834
L'arc En Ciel;Social Entraide;Estoublon;salle de l'école;04270;;;Publiée;Déclarée;;15/04/2015 (Alexandre Siahou);Non;;;0eff7001-1717-453b-9188-9cdbd6e82108
L'art des metiers;"Défense des droits fondamentaux, activités civiques; Art et Culture";Bras-d'Asse;Le village;04270;;;Publiée;Déclarée;20/09/2000;21/06/2015 (System);Non;;;5499f88a-0f05-4d6b-8169-771ee9884aae
L'art en chemin;"Comités de défense du patrimoine; Préservation du patrimoine; Art et Culture";Aiglun;Le vieil aiglun;04510;;;Publiée;Déclarée;20/12/2012;18/04/2016 (System);Non;W043001990;;da2bf694-1426-4ba3-8533-0a4c765f7966
L'assaut & co;Recherche;Digne-les-Bains;15, rue maldonnat;04000;;;Publiée;Déclarée;;15/04/2016 (System);Non;;;ba3ff2e8-57ee-4ce4-8b3d-41ce4ad39911
L'asse au contre vent;"Comités de défense, comités de sauvegarde; Comités de défense du patrimoine; Préservation du patrimoine; Environnement, Développement durable; Art et Culture; Protection de sites naturels";Saint-Jeannet;Lieu-dit pierre d'arc;04270;;;Publiée;Déclarée;24/10/2013;09/06/2015 (System);Non;W043002074;;4959a899-6206-4620-9683-0c3dcb88428d
L'asse de choeur;"Recherche; Art et Culture";Bras-d'Asse;Mairie;04270;;;Publiée;Déclarée;20/10/2002;14/04/2016 (System);Non;;;5c0382f9-23e8-414c-9357-f570b2169422
L'asse musicale;"Recherche; Art et Culture";Estoublon;Mairie, rue louis-laurens;04270;;;Publiée;Déclarée;;15/04/2016 (System);Non;;;1525adf7-ba63-463c-b4c0-0e0e1e4d63cf
L'association des chasseurs a l'approche des alpes-de-haute-provence;"Sports; Loisirs; Chasse; Chasse Pêche";Digne-les-Bains;49, avenue henri-jaubert, quartier la sèbe;04000;;;Publiée;Déclarée;20/08/2005;10/06/2015 (System);Non;;;efcea0e5-394c-4a44-b35d-c8bd8306d669
L'Atelier Partagé;"Social Entraide; Environnement, Développement durable; Bricolage";Digne-les-Bains;6 Rue Laurent de Lavoisier;04000;contact@atelier-partage.org;0612125031;Publiée;Déclarée;09/01/2015;13/02/2016 (Christophe Lucarz);Oui;;;5bbe3aed-3bee-4bdb-914e-d0451828af20
L'avrilopiscicophile moderne;"Autres collections; Collections; Loisirs; Actions socio-culturelles, centres de loisirs ; Avrilopiscicophile (Poissons d'avril)";Digne-les-Bains;Rocasoleil, bâtiment b 1, avenue georges-clemenceau;04000;;;Publiée;Déclarée;20/11/2000;22/06/2015 (System);Non;;;17da605f-9a89-45e3-8252-3f00161e64a6
L'ecrit d'etoiles;"Littérature; Activités artistiques; Art et Culture";Moustiers-Sainte-Marie;L'ancienne usine électrique;04360;;;Publiée;Déclarée;20/03/2001;22/06/2015 (System);Non;;;e6fd2b2e-7a79-4d14-9edd-a372e7846fd2
L'enfance sans bleu, ni violee;"Aide aux enfants maltraités; Social Entraide; Interventions sociales";Digne-les-Bains;35, boulevard gassendi;04000;alice1321@free.fr;;Publiée;Déclarée;30/10/2009;15/06/2015 (System);Non;W043000585;;82858973-e288-42c9-8fad-cabd332bc755
L'enfant d'o;"Social Entraide; Interventions sociales; Associations familiales, services sociaux pour les familles";Digne-les-Bains;Centre desmichels;04000;;;Publiée;Déclarée;20/08/2001;23/06/2015 (System);Non;;;67408d6c-19e8-4baf-9b70-4bae3301703b
L'espoir pour digne-les-bains - « sempre digno » groupe independant;Politique;Digne-les-Bains;7, rue jean-des-figues;04000;;;Publiée;Déclarée;20/06/2008;12/06/2015 (System);Non;;;6435fdac-f95d-4e1c-900b-25ac0a83eef5
L'étincelle Sieyenne  “la Belugue”;Danse;Digne-les-Bains;Annexe du Château des Sièyes;04000;;0492314398;Publiée;Déclarée;01/01/1900;25/03/2015 (Elias Administrateur Galoo);Non;;;26d68b1a-9112-4cd8-8305-36b54e989f1c
L'eveil de chabrieres;"Social Entraide; Représentation d'intérêts régionaux et locaux; Economie; Interventions sociales; Représentation, promotion et défense d'intérêts économiques";Mézel;Route nationale 85, chabrières;04270;;;Publiée;Dissoute;;19/04/2016 (System);Non;W043000289;;0e9327a2-1784-4d12-8d28-61429c291449
L'okoule;"Musique; Chant, Chorale; Activités artistiques; Art et Culture";Bras-d’Asse;Chemin de l'École;04270;;;Publiée;Déclarée;20/11/2008;12/06/2015 (System);Non;W043000119;;e8c63ea1-66f8-4fe8-8933-baa817b79fb1
L'oustalado;Autres catégories;Digne-les-Bains;18, rue saint-jaume;04000;;;Publiée;Dissoute;;15/04/2016 (System);Non;;;f56abb5a-d9c3-4551-a4c0-b7d61809469f
L'oustaou dei libre;Art et Culture;Moustiers-Sainte-Marie;Mairie;04360;;;Publiée;Déclarée;20/05/2002;14/04/2016 (System);Non;;;d0433873-1cec-4d15-9068-8f6f9bca1fcd
L'ouvroir;"Recherche; Art et Culture";Digne-les-Bains;Chemin de Saint-Martin;04000;;;Publiée;Déclarée;19/12/1997;03/06/2015 (System);Non;;;d1547048-0ab9-4d2a-9020-4e57c2ab6407
La bauca;Education environnement et développement durable;Bras-d'Asse;Lieu-dit le grand courtier;04270;;;Publiée;Déclarée;20/06/2015;18/04/2016 (System);Non;W043002241;;99718939-d0bd-4ae0-a289-4a5033875c2c
La bleone association pour la peche protection du milieu aquatique (A.P.P.M.A.);Pêche;Digne-les-Bains;Lac de gaubert;04000;;0492310086;Publiée;Déclarée;01/01/1900;26/03/2015 (Alexandre Siahou);Non;;;5290ae50-ddbf-4679-8d7c-a1d7a51d4ac3
La boule de moustiers;Pétanque, Boules (général);Moustiers-Sainte-Marie;Mairie;04360;;;Publiée;Déclarée;20/01/2016;19/04/2016 (System);Non;W043002300;;e313fbb5-fc22-47f0-8615-38bd4bfb2af3
La boule dignoise;"Pétanque, Boules (général); Sports collectifs; Sports";Digne-les-Bains;Cours des arès;04000;;0492363893;Publiée;Déclarée;01/01/1900;10/06/2015 (System);Non;W043000302;;b12e04e6-be64-4e08-a2ac-a8404889510c
La boule sieyenne;Pétanque, Boules (général);Digne-les-Bains;Bar tabac les sièyes;04000;;0492310660;Publiée;Déclarée;01/01/1900;26/03/2015 (Alexandre Siahou);Non;;;47246d93-d30a-4f26-8105-dca6ff018e04
La boussolet estoublonnaise;"Art et Culture; Information et Communication";Estoublon;Mairie;04270;;;Publiée;Déclarée;20/06/2002;14/04/2016 (System);Non;;;1b7f65c7-e179-448c-a5d4-974a1280e7dc
La Claire Fontaine;Chant, Chorale;Digne-les-Bains;6 Rue des Grognards;04000;moniquel832@gmail.com;0632366450;Publiée;Déclarée;;19/09/2016 (Jean-Christophe LEONARD);Oui;;;58b08206-8346-4cf6-9337-3dafa8e78c39
La compagnie du grimoire;Théâtre;Digne-les-Bains;6,Avenue Maréchal Leclerc Usso;04000;;0492305870;Publiée;Non déclarée;;25/04/2014 (sandrine Fabry);Non;;;ff70195e-34e6-4ac6-94e6-d5a6adfd055d
La detente des 3 asses;"Sports; Information et Communication";Barrême;Saint-Jean;04330;;;Publiée;Déclarée;20/09/2008;12/06/2015 (System);Non;;;d7a0d87d-159b-49d1-b6fc-81eb5c75ac1d
La dignoise;"Sports mécaniques; Sports individuels; Sports";Digne-les-Bains;48 Rue de la Platrière;04000;;;Publiée;Déclarée;20/11/2014;09/06/2015 (System);Non;W043002180;;542a8653-ebef-4f48-939d-181fcb9b48c4
La farandole;Autres catégories;Aiglun;Mairie;04510;;;Publiée;Dissoute;;15/04/2016 (System);Non;;;360b7f2e-5575-4c60-8ad8-10a030d4767f
La ligue de l'enseignement 04 service culturel;Représentation, promotion et défense d'intérêts économiques;Digne-les-Bains;9, chemin des alpilles;04000;culture04@laligue-alpesdusud.org;0492309103;Publiée;Déclarée;01/01/1900;26/03/2015 (Alexandre Siahou);Non;;;b38259e3-3c7f-46a3-807c-46814b8802aa
La maniere des arts;Art et Culture;Digne-les-Bains;2 Rue Colonel Payan;04000;;;Publiée;Déclarée;25/02/2008;12/06/2015 (System);Non;;;1aae8784-ae68-4070-b13c-62b1f589f17f
La manivelle du bonheur;"Musique; Chant, Chorale; Activités artistiques; Art et Culture";Digne-les-Bains;13 Rue de Coste Plane;04000;;;Publiée;Déclarée;20/10/2010;16/06/2015 (System);Non;W043000963;;8a9407d8-b10f-43fa-b431-93624620cc6c
La marguerite;Groupements d'entraide et de solidarité;Digne-les-Bains;21,, rue st vincent- les arches;04000;;;Publiée;Déclarée;20/06/2015;18/04/2016 (System);Non;W043002244;;2606c58b-f0b9-49ad-82d4-413683c84039
La meyronnette;Logement;Digne-les-Bains;46, avenue françois cuzin;04000;meyronnette@wanadoo.fr;0492360494;Publiée;Déclarée;01/01/1900;27/03/2015 (sandrine Fabry);Non;;;720926c8-0c4c-4721-8b40-66a20b5558ea
La pensee sauvage;"Environnement, Développement durable; Education environnement et développement durable";Estoublon;Lieu-dit le moulin d'huile;04270;;;Publiée;Déclarée;20/11/2014;09/06/2015 (System);Non;W043002178;;4e764aa2-306d-4b67-9988-66fc07649015
La photo au service des autres;Photographie, cinéma;Digne-les-Bains;27,, rue du lieutenant chaspoul;04000;;;Publiée;Déclarée;20/10/2016;30/10/2016 (System);Non;W043002384;;75cb70bb-6e5d-4c90-826d-9e7a1dd67ec7
La populaire;"Social Entraide; Humanitaire et Caritatif; Secours financiers et services aux personnes en difficultés";Digne-les-Bains;42, boulevard victor hugo;04000;;;Publiée;Déclarée;;17/04/2016 (System);Non;W043001129;;2b773182-e4d6-4b42-b6ca-ed83b94fb4f6
La robine en fete;Art et Culture;La Robine-sur-Galabre;Maison des associations;04000;;;Publiée;Déclarée;20/04/2008;12/06/2015 (System);Non;;;3d69cc49-1338-4774-a474-05eb7ab03b60
La ruche moustieraine, club inter-ages;"Actions socio-culturelles, centres de loisirs ; Interventions sociales";Moustiers-Sainte-Marie;Hôtel-dieu, rue de la bourgade;04360;;;Publiée;Déclarée;;14/04/2016 (System);Non;;;0932b1d1-eb98-42bb-99bb-fdbafd0658a0
La sauce;"Activités festives (soirées); Loisirs; Art et Culture";Barrême;Place de l'Église;04330;;;Publiée;Déclarée;20/03/2014;09/06/2015 (System);Non;W151003741;;303fab3e-c006-46bf-bf25-9ac4e83cc53d
La sauce de haute-provence;"Social Entraide; Actions socio-culturelles, centres de loisirs ; Art et Culture";Digne-les-Bains;Chemin de la bigue, courbons;04000;;;Publiée;Déclarée;;16/06/2015 (System);Non;;;29174872-fe3f-44c1-8497-1a8a3f4fd5db
La tanairo;Interventions sociales;La Robine-sur-Galabre;Maison des associations, le forest;04000;;;Publiée;Déclarée;;14/04/2016 (System);Non;;;51c5f795-1e25-4540-a519-baf2f3b5baa9
Langages;"Culture - Langues / dialectes / patois; Art et Culture";Digne-les-Bains;48 Avenue Henri Jaubert;04000;;;Publiée;Déclarée;20/10/1999;23/06/2015 (System);Non;;;77d66280-e36e-4965-a718-834470ecbaf9
L.a.r.t. passion (LAMBERT- AINAC- LA ROBINE- TANARON);Collections pour la sauvegarde et l'entretien du patrimoine;La Robine-sur-Galabre;Maison des associations, le forest;04000;;;Publiée;Déclarée;20/03/2016;19/04/2016 (System);Non;W043002327;;546b049c-d9a0-451f-b57d-2fc4eb19219f
ldh digne vallee;Défense des droits fondamentaux, activités civiques;Digne-les-Bains;15 rue de la curaterie;04000;;;Publiée;Déclarée;;16/06/2015 (Florie Viguier);Oui;;;329e2fc5-1f2d-40fb-be08-f3a40d177d9d
Le bastringue;"Danse; Activités artistiques; Art et Culture";Digne-les-Bains;11,, rue des ébénistes;04000;;;Publiée;Déclarée;30/03/2010;15/06/2015 (System);Non;W043000689;;a0e8e24c-089e-436e-aad5-68616460ceaa
Le cercle dignois du reveil (LE CEDRE);Religion, Culte, Philosophie;Marcoux;Lieu-dit La Grand-Colle;04420;;;Publiée;Déclarée;;23/06/2015 (System);Non;;;471ccdc5-c8e4-48a3-b595-ba58c1e4a6de
Le courage c'est l'oxygene de la vie;"Recherche; Loisirs scientifiques et techniques; Loisirs";Digne-les-Bains;Les arches, 4, rue maldonat;04000;;;Publiée;Déclarée;;05/06/2015 (System);Non;;;5d807d84-a865-4b7d-b027-9bfd1ca3a89c
Le cynorhodon libertaire;"Musique; Politique; Activités artistiques; Art et Culture";Digne-les-Bains;5, chemin de l'iscle-des-abbées;04000;;;Publiée;Déclarée;20/10/2001;25/06/2015 (System);Non;;;283192c2-078c-4d90-a36e-71d91c61f81d
Le dharma digne;"Religion, Culte, Philosophie; Social Entraide";Digne-les-Bains;1 Rue Jean Gaspard Gassend;04000;;;Publiée;Déclarée;20/03/2010;15/06/2015 (System);Non;W043000670;;e9dab33d-74c4-4a5a-bf1c-9746e9874542
Le Gambit Dignois;Jeux de société;Digne-les-Bains;21, rue C.Grouiller;04000;;0492316583;Publiée;Déclarée;01/01/1900;25/03/2015 (Elias Administrateur Galoo);Non;;;1d557c13-e98d-45fb-8cc1-7886818a7cbe
Le jardin des sports;Sports;Moustiers-Sainte-Marie;Quartier saint-michel;04360;;;Publiée;Déclarée;;15/04/2016 (System);Non;;;45b4d9d7-b322-414f-a1a7-4d6cc98b4d6f
Le marrakech;"Cercles privés / Fan clubs; Loisirs";Digne-les-Bains;8 Place Pied de ville;04000;;;Publiée;Déclarée;20/08/2010;15/06/2015 (System);Non;W043000869;;7624a88d-dd65-4d53-b0dd-cc0f556a622f
Le sentier culinaire gassendi;"Théâtre; Art / Spectacle de la rue; Loisirs; Arts de la rue; Gastronomie - œnologie - confréries - gourmets; Activités artistiques; Art et Culture";Champtercier;Quartier les couestes;04660;;;Publiée;Déclarée;20/09/2012;17/04/2016 (System);Non;W043001959;;1f5b8e83-884e-41e9-ae61-50d03c792dcd
Le service d'ecriture publique provence;Presse, édition;Digne-les-Bains;Résidence le coteau de la bléone, 8,, avenue du colonel noël;04000;;;Publiée;Déclarée;20/01/2016;19/04/2016 (System);Non;W043002299;;537a0064-b787-4e0f-8fc2-e4df02a44323
Le singe de l'encre;"Recherche; Social Entraide; Interventions sociales; Art et Culture; Education, Formation, Recherche";Digne-les-Bains;18, rue aubin, pôle social;04000;;;Publiée;Déclarée;;15/04/2016 (System);Non;;;82060d82-22f0-4274-98a3-1bd0b04a118d
Le Souvenir Français;Histoire;Digne-les-Bains;20 Route du Plan de Gaubert;04000;;;Publiée;Déclarée;;26/03/2015 (Alexandre Siahou);Non;;;99e73cf8-a793-470a-a85a-f77fad96418b
Le temps des caleches;Information et Communication;Digne-les-Bains;43, route du chaffaut;04000;;;Publiée;Déclarée;20/06/2007;11/06/2015 (System);Non;;;f96b1e9e-7065-4b6a-a9bd-5de72760d5ff
Le temps du corps;Sports;Digne-les-Bains;7, place saint-exupéry;04000;;;Publiée;Déclarée;;06/06/2015 (Jean-Christophe LEONARD);Non;;;2ba9d94c-05e3-4746-a3f7-9d94707f9a7a
Le velo en pays dignois;Cyclisme (Vélo);Digne-les-Bains;8,, rue bonthoux;04000;;;Publiée;Déclarée;20/02/2016;19/04/2016 (System);Non;W043002318;;2f8213da-9731-4845-9482-a7ddcf0c9305
L’Échiquier du Pays Dignois;Jeux d'echecs;Digne-les-Bains;48 rue Beethoven hameau Chanteclerc;04000;;0644192362;Publiée;Inconnu;;14/04/2016 (LOU  VANIE);Oui;;;11058935-94b0-4118-b85c-88a3c92044fb
Legion ware;"Autres supports de communication; Information et Communication";Digne-les-Bains;12,, impasse des coussières;04000;;;Publiée;Déclarée;23/06/2010;15/06/2015 (System);Non;W043000765;;3a559994-f83b-4ba5-b0f2-9e4fb0cb3171
Lei Dignosaures;Rugby;Digne-les-Bains;4 rue des Roseaux;04000;lei.dignosaures@wanadoo.fr;0492313304;Publiée;Déclarée;;26/03/2015 (Alexandre Siahou);Non;;;409cee77-49dc-4e1a-abb7-9caefd5ba504
Les 3 asses rallye passion;"Sports mécaniques; Sports individuels; Sports; Automobile; Rallye";Barrême;Place François Beraud;04330;;;Publiée;Déclarée;20/10/2005;10/06/2015 (System);Non;;;850dcb9a-4d00-4b00-b868-29ebf1af65e7
Les amis de jean arene;"Comités de défense du patrimoine; Préservation du patrimoine; Art et Culture";Moustiers-Sainte-Marie;Place de l'Eglise;04360;;;Publiée;Déclarée;20/01/2011;16/06/2015 (System);Non;W043001809;;df81c5d6-9f03-4ea6-9567-7faf94cbebc6
Les amis de la musique;"Social Entraide; Actions socio-culturelles, centres de loisirs ; Art et Culture";Digne-les-Bains;17, avenue du colonel-noël;04000;;;Publiée;Dissoute;20/04/2001;14/04/2016 (System);Non;;;8cde3517-4eb1-47c6-aba7-ac85b8f858de
Les amis de la tour;Loisirs;Digne-les-Bains;3 rue provence;04000;aat-cas@wanadoo.fr;0492322372;Publiée;Déclarée;;28/08/2014 (System);Non;;;3dea3242-3bcc-42c9-bb24-e9d345fa251c
Les amis de saint-julien-d'asse amitie, environnement, qualite de vie;"Environnement, Développement durable; Actions socio-culturelles, centres de loisirs ; Art et Culture";Saint-Julien-d'Asse;Le haut village;04270;;;Publiée;Déclarée;;15/04/2016 (System);Non;;;4a9463da-59da-414f-bc6c-88c94e6b1953
Les amis de san-antonio;"Social Entraide; Littérature; Activités artistiques; Art et Culture";Digne-les-Bains;1, rue des moissons;04000;;;Publiée;Déclarée;;15/06/2015 (System);Non;W043000626;;76367b81-4fb9-4137-8289-a072118149a5
Les amis des quatre mains;"Défense des droits fondamentaux, activités civiques; Justice; Activités civiques, information civique";Moustiers-Sainte-Marie;Embourgues 1;04360;;;Publiée;Déclarée;20/11/2011;17/04/2016 (System);Non;W043001887;;6bfd4654-2135-4c02-9e67-84eca3eb6430
Les Amis Dignois des Animaux;Animaux ;Digne-les-Bains;chenil municipal, les Isnards, route de Barles;04000;chenilmunicipal-digne@orange.fr;0492312020;Publiée;Déclarée;;06/06/2015 (Jean-Christophe LEONARD);Non;;;ccb897e7-9c07-4ab0-851d-fac2691ddc68
Les amis du canal st jean;"Comités de défense du patrimoine; Préservation du patrimoine; Art et Culture";Moustiers-Sainte-Marie;Chemin de l'Hert;04360;;;Publiée;Déclarée;21/02/2013;09/06/2015 (System);Non;W043002009;;b806bc76-ca31-420c-ab55-3b56a4b0072e
Les amis du pays dignais;"Défense des droits fondamentaux, activités civiques; Art et Culture";Digne-les-Bains;Centre associatif desmichels, boulevard martin-bret;04000;;;Publiée;Déclarée;;14/04/2016 (System);Non;;;1c286f5b-e972-4013-9290-df0dc702a9c7
Les arbitres du coeur;"Sports; Social Entraide; Interventions sociales";Digne-les-Bains;52, rue beethoven, hameau de champleclerc;04000;;;Publiée;Déclarée;20/11/2001;14/04/2016 (System);Non;;;78fa73d9-d449-44d7-b4aa-a2b153a895d1
Les archers de saint georges;Tir;Saint-Jurs;1,, rue de la forge;04410;;;Publiée;Déclarée;20/06/2015;18/04/2016 (System);Non;W043002242;;533ba9da-14fd-448c-be19-2797348422d4
Les artistes de moustiers;Art et Culture;Moustiers-Sainte-Marie;Mairie;04360;;;Publiée;Déclarée;19/09/1998;05/06/2015 (System);Non;;;b2fef7e1-a8fa-4300-a1f1-b3e17c664310
Les avions du carrefour;Actions socio-culturelles, centres de loisirs ;Digne-les-Bains;Centre hospitalier de digne;04000;;;Publiée;Déclarée;;15/04/2016 (System);Non;;;fbb891b6-7349-4b70-9506-31ff5c2440df
Les bas alpins;"Recherche; Loisirs scientifiques et techniques; Loisirs";Aiglun;24, avenue des grees;04510;;;Publiée;Déclarée;26/03/2001;22/06/2015 (System);Non;;;e597b881-b769-43f0-b19b-4e0cadff0d4a
Les batisseurs de la solidarite;"Social Entraide; Interventions sociales";Digne-les-Bains;3, rue des eglantiers, les ferréols;04000;;;Publiée;Déclarée;21/04/1999;07/06/2015 (System);Non;;;05d0eee8-81d9-41fd-96d7-245cfbfea199
Les beeh... colores;Autres catégories;Digne-les-Bains;15, rue jean-des-figues, la sèbe;04000;;;Publiée;Déclarée;;12/06/2015 (System);Non;;;bec02d6e-a38b-42cb-a829-755317c524dc
Les chevaliers de france - chapitre iii - digne-les-bains (04) - ASSOCIATION MOTOCYCLISTE DES FORCES DE L'ORDRE;"Sports; Social Entraide; Humanitaire et Caritatif; Actions socio-culturelles, centres de loisirs ; Interventions sociales";Digne-les-Bains;Boulevard martin-bret;04000;;;Publiée;Déclarée;19/03/1999;07/06/2015 (System);Non;;;4c2e7ffb-35d0-4271-9485-d35a275fa49a
Les copains d'abord;"Sports individuels; Sports; Danse sportive";Champtercier;8, résidence des coteaux;04660;;;Publiée;Déclarée;20/10/2012;18/04/2016 (System);Non;W043001969;;dfe779af-f04b-4142-bcf9-6fe2e717261c
Les copains d'abord Digne Les Bains;Amicale, groupement d'entraide, solidarité ;Digne-les-Bains;15, grand rue;04000;lescops04@gmail.com;;Publiée;Déclarée;;23/04/2014 (Jean-Christophe LEONARD);Non;;;63e45b65-9490-4734-bc92-48a3fa1026dc
Les copains d'abord du pays dignois;"Musique; Chant, Chorale; Activités artistiques; Art et Culture";Digne-les-Bains;24, chemin des marquis;04000;;;Publiée;Déclarée;30/08/2011;17/04/2016 (System);Non;W043001867;;23cbfa1e-2ebc-4858-8d6e-57584ef35e07
Les cousines de la poterie;Travaux manuels;Digne-les-Bains;17,, avenue du colonel noêl;04000;;;Publiée;Déclarée;20/03/2016;19/04/2016 (System);Non;W043002326;;c83569ad-c24e-4a75-9b65-e2dc82616891
Les coussieres;"Comité de défense, animation de quartier, asso municipale, associations riverains; Insertion, Aide à l'emploi, vie locale; Social Entraide; Représentation d'intérêts régionaux et locaux; Economie; Représentation, promotion et défense d'intérêts économiques";Digne-les-Bains;1 Rue du Chanoine Bondil;04000;;;Publiée;Déclarée;20/07/2009;14/06/2015 (System);Non;W043000469;;350b499e-1a66-4db4-b807-f9ec72a6a218
Les coyotes country;"Sports individuels; Sports; Danse sportive";Digne-les-Bains;6 Rue des Ammonites;04000;Les-coyotes-country@hotmail.fr;0984137153;Publiée;Déclarée;05/07/2012;17/04/2016 (System);Oui;W043001947;;cb067be1-7e1c-4aaf-95a5-78f110f8fd79
Les dignosaures;Autres catégories;Digne-les-Bains;31 Boulevard Gassendi;04000;;;Publiée;Déclarée;;08/06/2015 (System);Non;;;0bfa3999-34a3-4c48-9c77-cb3173ab6045
Les ecoles de la terre;"Interventions sociales; Art et Culture";Digne-les-Bains;16, avenue du camping;04000;;;Publiée;Déclarée;;16/04/2016 (System);Non;;;0c29e853-99a2-4d4e-be23-c254ae8f16a7
Les eleveurs de l'ubaye;"Association du personnel d'une entreprise (hors syndical) ; Social Entraide; Amicale, groupement d'entraide, solidarité ";Digne-les-Bains;66 boulevard gassendi;04000;;;Publiée;Déclarée;26/07/2010;15/06/2015 (System);Non;W043000860;;849de1fa-407c-46a9-aec7-9f9fe58bf7d6
